{
  "date": "2026-10-21",
  "generated_at": "2026-10-21T05:59:41.818Z",
  "label": "趋势词快照",
  "note": "仅表示这些词在近期公开网页的搜索结果中出现过，不代表搜索量、销量或增长趋势；使用前请自行判断。",
  "provider": {
    "search": "tavily",
    "model": "deepseek-flash"
  },
  "searches": 27,
  "markets": [
    {
      "market": "en-US",
      "categories": [
        {
          "id": "consumer-electronics",
          "name": "Consumer electronics & accessories",
          "status": "ok",
          "sources_seen": 18,
          "rejected_terms": 1,
          "rejected_reasons": {
            "term_not_in_evidence": 1
          },
          "terms": [
            {
              "term": "wireless earbuds",
              "evidence": "I tested more than 40 pairs over two years to find the best wireless earbuds.",
              "signal": "mentioned",
              "source_url": "https://www.forbes.com/sites/forbes-personal-shopper/article/the-best-wireless-earbuds",
              "source_title": "The Best Wireless Earbuds, After Testing More Than 40 Pairs",
              "published_date": "2026-10-20"
            },
            {
              "term": "Bluetooth speakers",
              "evidence": "1) cheap phone chargers, 2) slow data cables, 3) cheap power banks, 4) cheap Bluetooth speakers and headphones, 5) cheap earphones and ear pods,",
              "signal": "mentioned",
              "source_url": "https://www.facebook.com/Kagantech/videos/5-tech-gadgets-you-should-never-buy-the-cheapest-available-its-ruining-your-life/2412180002647314",
              "source_title": "5 tech gadgets you should never buy the cheapest ..."
            },
            {
              "term": "power banks",
              "evidence": "1) cheap phone chargers, 2) slow data cables, 3) cheap power banks, 4) cheap Bluetooth speakers and headphones, 5) cheap earphones and ear pods,",
              "signal": "mentioned",
              "source_url": "https://www.facebook.com/Kagantech/videos/5-tech-gadgets-you-should-never-buy-the-cheapest-available-its-ruining-your-life/2412180002647314",
              "source_title": "5 tech gadgets you should never buy the cheapest ..."
            },
            {
              "term": "phone chargers",
              "evidence": "1) cheap phone chargers, 2) slow data cables, 3) cheap power banks, 4) cheap Bluetooth speakers and headphones, 5) cheap earphones and ear pods,",
              "signal": "mentioned",
              "source_url": "https://www.facebook.com/Kagantech/videos/5-tech-gadgets-you-should-never-buy-the-cheapest-available-its-ruining-your-life/2412180002647314",
              "source_title": "5 tech gadgets you should never buy the cheapest ..."
            },
            {
              "term": "USB-C hubs",
              "evidence": "There are three accessories in the collection, which include two USB-C hubs: the OntheGo 5-in-1 Multiport Adapter ($45) and the USB-C Snap Hub ($45).",
              "signal": "mentioned",
              "source_url": "https://www.gearpatrol.com/audio/best-tech-audio-hi-fi-releases-2026-october-week-2",
              "source_title": "The Best New Gadgets and Hi-Fi Releases of 2026 (Updated)",
              "published_date": "2026-10-16"
            },
            {
              "term": "wireless mouse",
              "evidence": "And there’s Satechi’s Slim EX wireless mouse ($30).",
              "signal": "mentioned",
              "source_url": "https://www.gearpatrol.com/audio/best-tech-audio-hi-fi-releases-2026-october-week-2",
              "source_title": "The Best New Gadgets and Hi-Fi Releases of 2026 (Updated)",
              "published_date": "2026-10-16"
            },
            {
              "term": "wearable voice recorder",
              "evidence": "NotePin S is a wearable voice recorder built for meetings, interviews and other situations wher",
              "signal": "mentioned",
              "source_url": "https://myfox8.com/reviews/br/electronics-br/cell-phones-accessories-br/times-best-inventions-of-2026-the-most-affordable-electronics-on-the-list",
              "source_title": "Time’s Best Inventions of 2026: The most affordable electronics on the list",
              "published_date": "2026-10-15"
            }
          ]
        },
        {
          "id": "home-kitchen",
          "name": "Home & kitchen",
          "status": "ok",
          "sources_seen": 20,
          "rejected_terms": 1,
          "rejected_reasons": {
            "term_too_long": 1
          },
          "terms": [
            {
              "term": "mixing bowl set",
              "evidence": "Make mixing and meal prep easier with the Oxo Good Grips three-piece stainless steel mixing bowl set.",
              "signal": "mentioned",
              "source_url": "https://www.youtube.com/watch?v=3n61rnCDbt8&vl=ja",
              "source_title": "30 Trending Amazon Kitchen Tools That Are Going Viral Right Now",
              "published_date": "2026-10-17"
            },
            {
              "term": "automatic jar opener",
              "evidence": "The featured items include an automatic jar opener for stubborn lids",
              "signal": "mentioned",
              "source_url": "https://www.facebook.com/firstmediasoyummy/posts/these-clever-kitchen-gadgets-take-everyday-results-up-a-notch/1754779626693726",
              "source_title": "These clever kitchen gadgets take everyday results up a ..."
            },
            {
              "term": "manual vegetable chopper",
              "evidence": "a manual vegetable chopper for quick salad prep",
              "signal": "mentioned",
              "source_url": "https://www.facebook.com/firstmediasoyummy/posts/these-clever-kitchen-gadgets-take-everyday-results-up-a-notch/1754779626693726",
              "source_title": "These clever kitchen gadgets take everyday results up a ..."
            },
            {
              "term": "handheld vacuum sealer",
              "evidence": "and a handheld vacuum sealer for",
              "signal": "mentioned",
              "source_url": "https://www.facebook.com/firstmediasoyummy/posts/these-clever-kitchen-gadgets-take-everyday-results-up-a-notch/1754779626693726",
              "source_title": "These clever kitchen gadgets take everyday results up a ..."
            },
            {
              "term": "dish scrubber",
              "evidence": "For a longer-lasting alternative, consider a dish scrubber, like this OXO one",
              "signal": "mentioned",
              "source_url": "https://www.delish.com/kitchen-tools/kitchen-secrets/a73762597/kitchen-items-over-30",
              "source_title": "Experts Say No One Over 30 Should Still Be Using These Kitchen Items",
              "published_date": "2026-10-16"
            },
            {
              "term": "countertop ice maker",
              "evidence": "15: Countertop ice maker -",
              "signal": "mentioned",
              "source_url": "https://www.youtube.com/watch?v=AUJQkLyIwDA&vl=hi",
              "source_title": "15 Amazon Kitchen Gadgets That Solve Everyday Problems!",
              "published_date": "2026-10-17"
            },
            {
              "term": "drawer organizers",
              "evidence": "It features specific items like valet rods, under-sink bins, shoe stackers, and drawer organizers",
              "signal": "mentioned",
              "source_url": "https://www.facebook.com/themertenshome/videos/less-clutter-less-digging-through-drawers-and-zero-regrets-comment-organize-and/1113908301357972",
              "source_title": "Less clutter, less digging through drawers, and zero regrets ..."
            }
          ]
        },
        {
          "id": "beauty-personal-care",
          "name": "Beauty & personal care",
          "status": "ok",
          "sources_seen": 13,
          "rejected_terms": 3,
          "rejected_reasons": {
            "term_not_in_evidence": 2,
            "evidence_is_just_term": 1
          },
          "terms": [
            {
              "term": "firming gel mask",
              "evidence": "Meet the Torriden CELLMAZING Firming Gel Mask",
              "signal": "mentioned",
              "source_url": "https://www.facebook.com/SkinSAFEProducts/posts/-founders-favorites-friday-this-week-skinsafe-founder-michelle-d-worth-is-sharin/1738850204911679",
              "source_title": "SkinSAFE"
            },
            {
              "term": "concealer sticks",
              "evidence": "Concealer sticks are a popular product that you glide or dab on your skin.",
              "signal": "stated_trending",
              "source_url": "https://www.mypsoriasisteam.com/resources/best-makeup-and-cosmetics-for-psoriasis",
              "source_title": "Best Makeup for Psoriasis: Foundation, Concealer, and More | MyPsoriasisTeam",
              "published_date": "2026-10-16"
            },
            {
              "term": "cushion foundation",
              "evidence": "SHEGLAM LUMI CUSHION FOUNDATION",
              "signal": "mentioned",
              "source_url": "https://www.elle.com/beauty/a74065349/best-korean-beauty-products-ulta",
              "source_title": "Best K-Beauty Products at Ulta Beauty, From Classics to New Finds",
              "published_date": "2026-10-14"
            },
            {
              "term": "styling dryer brush",
              "evidence": "Airsmooth Styling Dryer Brush",
              "signal": "mentioned",
              "source_url": "https://www.ulta.com/brand/mermade-hair?category=gifts%2Cby-category%2Ctool-brush-gifts",
              "source_title": "Mermade Hair - Tool & Brush Gifts - 1 Products | Ulta Beauty",
              "published_date": "2026-10-17"
            },
            {
              "term": "hair bonnets",
              "evidence": "The Best Silk and Satin Hair Bonnets",
              "signal": "mentioned",